mysql> CREATE TABLE employees (
    ->     emp_id INT PRIMARY KEY,
    ->     emp_name VARCHAR(100),
    ->     department VARCHAR(50),
    ->     job_role VARCHAR(50),
    ->     salary DECIMAL(10,2),
    ->     joining_date DATE,
    ->     city VARCHAR(50)
    -> );
Query OK, 0 rows affected (0.06 sec)

mysql> INSERT INTO employees
    -> (emp_id, emp_name, department, job_role, salary, joining_date, city)
    -> VALUES
    -> (101, 'Ravi Kumar', 'IT', 'Developer', 45000, '2023-01-15', 'Vizag'),
    -> (102, 'Priya Sharma', 'HR', 'HR Manager', 55000, '2022-06-20', 'Hyderabad'),
    -> (103, 'Kiran Reddy', 'IT', 'Tester', 40000, '2023-03-10', 'Vizag'),
    -> (104, 'Sneha Rao', 'Finance', 'Accountant', 48000, '2021-11-25', 'Chennai'),
    -> (105, 'Arun Kumar', 'IT', 'Developer', 60000, '2020-08-18', 'Bangalore'),
    -> (106, 'Divya Reddy', 'HR', 'Recruiter', 35000, '2024-01-05', 'Vizag'),
    -> (107, 'Suresh Babu', 'Sales', 'Executive', 42000, '2022-09-12', 'Hyderabad'),
    -> (108, 'Anjali Devi', 'IT', 'Developer', 70000, '2019-05-30', 'Chennai'),
    -> (109, 'Mahesh Kumar', 'Sales', 'Manager', 65000, '2020-02-14', 'Bangalore'),
    -> (110, 'Lakshmi Rao', 'Finance', 'Analyst', 52000, '2023-07-22', 'Hyderabad');
Query OK, 10 rows affected (0.04 sec)
Records: 10  Duplicates: 0  Warnings: 0

mysql> select * from employees;
+--------+--------------+------------+------------+----------+--------------+-----------+
| emp_id | emp_name     | department | job_role   | salary   | joining_date | city      |
+--------+--------------+------------+------------+----------+--------------+-----------+
|    101 | Ravi Kumar   | IT         | Developer  | 45000.00 | 2023-01-15   | Vizag     |
|    102 | Priya Sharma | HR         | HR Manager | 55000.00 | 2022-06-20   | Hyderabad |
|    103 | Kiran Reddy  | IT         | Tester     | 40000.00 | 2023-03-10   | Vizag     |
|    104 | Sneha Rao    | Finance    | Accountant | 48000.00 | 2021-11-25   | Chennai   |
|    105 | Arun Kumar   | IT         | Developer  | 60000.00 | 2020-08-18   | Bangalore |
|    106 | Divya Reddy  | HR         | Recruiter  | 35000.00 | 2024-01-05   | Vizag     |
|    107 | Suresh Babu  | Sales      | Executive  | 42000.00 | 2022-09-12   | Hyderabad |
|    108 | Anjali Devi  | IT         | Developer  | 70000.00 | 2019-05-30   | Chennai   |
|    109 | Mahesh Kumar | Sales      | Manager    | 65000.00 | 2020-02-14   | Bangalore |
|    110 | Lakshmi Rao  | Finance    | Analyst    | 52000.00 | 2023-07-22   | Hyderabad |
+--------+--------------+------------+------------+----------+--------------+-----------+
10 rows in set (0.00 sec)

mysql>
mysql> alter table employees add email varchar(100);
Query OK, 0 rows affected (0.05 sec)
Records: 0  Duplicates: 0  Warnings: 0

mysql> alter table employees add phone varchar(15);
Query OK, 0 rows affected (0.06 sec)
Records: 0  Duplicates: 0  Warnings: 0

mysql> alter table employees modify column department varchar(100);
Query OK, 10 rows affected (0.08 sec)
Records: 10  Duplicates: 0  Warnings: 0

mysql> alter table employees modify column salary decimal(12,2);
Query OK, 10 rows affected (0.04 sec)
Records: 10  Duplicates: 0  Warnings: 0

mysql> alter table employees rename column city to location;
Query OK, 0 rows affected (0.02 sec)
Records: 0  Duplicates: 0  Warnings: 0

mysql> select * from employees;
+--------+--------------+------------+------------+----------+--------------+-----------+-------+-------+
| emp_id | emp_name     | department | job_role   | salary   | joining_date | location  | email | phone |
+--------+--------------+------------+------------+----------+--------------+-----------+-------+-------+
|    101 | Ravi Kumar   | IT         | Developer  | 45000.00 | 2023-01-15   | Vizag     | NULL  | NULL  |
|    102 | Priya Sharma | HR         | HR Manager | 55000.00 | 2022-06-20   | Hyderabad | NULL  | NULL  |
|    103 | Kiran Reddy  | IT         | Tester     | 40000.00 | 2023-03-10   | Vizag     | NULL  | NULL  |
|    104 | Sneha Rao    | Finance    | Accountant | 48000.00 | 2021-11-25   | Chennai   | NULL  | NULL  |
|    105 | Arun Kumar   | IT         | Developer  | 60000.00 | 2020-08-18   | Bangalore | NULL  | NULL  |
|    106 | Divya Reddy  | HR         | Recruiter  | 35000.00 | 2024-01-05   | Vizag     | NULL  | NULL  |
|    107 | Suresh Babu  | Sales      | Executive  | 42000.00 | 2022-09-12   | Hyderabad | NULL  | NULL  |
|    108 | Anjali Devi  | IT         | Developer  | 70000.00 | 2019-05-30   | Chennai   | NULL  | NULL  |
|    109 | Mahesh Kumar | Sales      | Manager    | 65000.00 | 2020-02-14   | Bangalore | NULL  | NULL  |
|    110 | Lakshmi Rao  | Finance    | Analyst    | 52000.00 | 2023-07-22   | Hyderabad | NULL  | NULL  |
+--------+--------------+------------+------------+----------+--------------+-----------+-------+-------+
10 rows in set (0.00 sec)

mysql> alter table employees drop column phone;
Query OK, 0 rows affected (0.06 sec)
Records: 0  Duplicates: 0  Warnings: 0

mysql> select * from employees;
+--------+--------------+------------+------------+----------+--------------+-----------+-------+
| emp_id | emp_name     | department | job_role   | salary   | joining_date | location  | email |
+--------+--------------+------------+------------+----------+--------------+-----------+-------+
|    101 | Ravi Kumar   | IT         | Developer  | 45000.00 | 2023-01-15   | Vizag     | NULL  |
|    102 | Priya Sharma | HR         | HR Manager | 55000.00 | 2022-06-20   | Hyderabad | NULL  |
|    103 | Kiran Reddy  | IT         | Tester     | 40000.00 | 2023-03-10   | Vizag     | NULL  |
|    104 | Sneha Rao    | Finance    | Accountant | 48000.00 | 2021-11-25   | Chennai   | NULL  |
|    105 | Arun Kumar   | IT         | Developer  | 60000.00 | 2020-08-18   | Bangalore | NULL  |
|    106 | Divya Reddy  | HR         | Recruiter  | 35000.00 | 2024-01-05   | Vizag     | NULL  |
|    107 | Suresh Babu  | Sales      | Executive  | 42000.00 | 2022-09-12   | Hyderabad | NULL  |
|    108 | Anjali Devi  | IT         | Developer  | 70000.00 | 2019-05-30   | Chennai   | NULL  |
|    109 | Mahesh Kumar | Sales      | Manager    | 65000.00 | 2020-02-14   | Bangalore | NULL  |
|    110 | Lakshmi Rao  | Finance    | Analyst    | 52000.00 | 2023-07-22   | Hyderabad | NULL  |
+--------+--------------+------------+------------+----------+--------------+-----------+-------+
10 rows in set (0.00 sec)

mysql> alter table employees add experience int;
Query OK, 0 rows affected (0.07 sec)
Records: 0  Duplicates: 0  Warnings: 0

mysql> select * from employees;
+--------+--------------+------------+------------+----------+--------------+-----------+-------+------------+
| emp_id | emp_name     | department | job_role   | salary   | joining_date | location  | email | experience |
+--------+--------------+------------+------------+----------+--------------+-----------+-------+------------+
|    101 | Ravi Kumar   | IT         | Developer  | 45000.00 | 2023-01-15   | Vizag     | NULL  |       NULL |
|    102 | Priya Sharma | HR         | HR Manager | 55000.00 | 2022-06-20   | Hyderabad | NULL  |       NULL |
|    103 | Kiran Reddy  | IT         | Tester     | 40000.00 | 2023-03-10   | Vizag     | NULL  |       NULL |
|    104 | Sneha Rao    | Finance    | Accountant | 48000.00 | 2021-11-25   | Chennai   | NULL  |       NULL |
|    105 | Arun Kumar   | IT         | Developer  | 60000.00 | 2020-08-18   | Bangalore | NULL  |       NULL |
|    106 | Divya Reddy  | HR         | Recruiter  | 35000.00 | 2024-01-05   | Vizag     | NULL  |       NULL |
|    107 | Suresh Babu  | Sales      | Executive  | 42000.00 | 2022-09-12   | Hyderabad | NULL  |       NULL |
|    108 | Anjali Devi  | IT         | Developer  | 70000.00 | 2019-05-30   | Chennai   | NULL  |       NULL |
|    109 | Mahesh Kumar | Sales      | Manager    | 65000.00 | 2020-02-14   | Bangalore | NULL  |       NULL |
|    110 | Lakshmi Rao  | Finance    | Analyst    | 52000.00 | 2023-07-22   | Hyderabad | NULL  |       NULL |
+--------+--------------+------------+------------+----------+--------------+-----------+-------+------------+
10 rows in set (0.00 sec)

mysql> insert into employees(111,'Rahul Singh','IT','Developer',50000,'2024-05-15','Vizag');
ERROR 1064 (42000): You have an error in your SQL syntax; check the manual that corresponds to your MySQL server version for the right syntax to use near '111,'Rahul Singh','IT','Developer',50000,'2024-05-15','Vizag')' at line 1
mysql> insert into employees()(111,'Rahul Singh','IT','Developer',50000,'2024-05-15','Vizag');
ERROR 1064 (42000): You have an error in your SQL syntax; check the manual that corresponds to your MySQL server version for the right syntax to use near '111,'Rahul Singh','IT','Developer',50000,'2024-05-15','Vizag')' at line 1
mysql> insert into employees(emp_id,emp_name,department,job_role,salary,joining_date,location)
    -> values(111,'Rahul Singh','IT','Developer',50000,'2024-05-15','Vizag');
Query OK, 1 row affected (0.04 sec)

mysql> insert into employees(emp_id,emp_name,department,job_role,salary,joining_date,location)
    -> values(112,'Shruthi','IT','Tester',70000,'2024-07-23','Chennai'),
    -> (113,'Gautham Sai','IT','AI & ML Engineer',90000,'2024-02-27','Banglore'),
    -> (114,'Nirup','IT','CyberSecurity',75000,'2025-10-30','Hyderabad');
Query OK, 3 rows affected (0.04 sec)
Records: 3  Duplicates: 0  Warnings: 0

mysql> select * from employees;
+--------+--------------+------------+------------------+----------+--------------+-----------+-------+------------+
| emp_id | emp_name     | department | job_role         | salary   | joining_date | location  | email | experience |
+--------+--------------+------------+------------------+----------+--------------+-----------+-------+------------+
|    101 | Ravi Kumar   | IT         | Developer        | 45000.00 | 2023-01-15   | Vizag     | NULL  |       NULL |
|    102 | Priya Sharma | HR         | HR Manager       | 55000.00 | 2022-06-20   | Hyderabad | NULL  |       NULL |
|    103 | Kiran Reddy  | IT         | Tester           | 40000.00 | 2023-03-10   | Vizag     | NULL  |       NULL |
|    104 | Sneha Rao    | Finance    | Accountant       | 48000.00 | 2021-11-25   | Chennai   | NULL  |       NULL |
|    105 | Arun Kumar   | IT         | Developer        | 60000.00 | 2020-08-18   | Bangalore | NULL  |       NULL |
|    106 | Divya Reddy  | HR         | Recruiter        | 35000.00 | 2024-01-05   | Vizag     | NULL  |       NULL |
|    107 | Suresh Babu  | Sales      | Executive        | 42000.00 | 2022-09-12   | Hyderabad | NULL  |       NULL |
|    108 | Anjali Devi  | IT         | Developer        | 70000.00 | 2019-05-30   | Chennai   | NULL  |       NULL |
|    109 | Mahesh Kumar | Sales      | Manager          | 65000.00 | 2020-02-14   | Bangalore | NULL  |       NULL |
|    110 | Lakshmi Rao  | Finance    | Analyst          | 52000.00 | 2023-07-22   | Hyderabad | NULL  |       NULL |
|    111 | Rahul Singh  | IT         | Developer        | 50000.00 | 2024-05-15   | Vizag     | NULL  |       NULL |
|    112 | Shruthi      | IT         | Tester           | 70000.00 | 2024-07-23   | Chennai   | NULL  |       NULL |
|    113 | Gautham Sai  | IT         | AI & ML Engineer | 90000.00 | 2024-02-27   | Banglore  | NULL  |       NULL |
|    114 | Nirup        | IT         | CyberSecurity    | 75000.00 | 2025-10-30   | Hyderabad | NULL  |       NULL |
+--------+--------------+------------+------------------+----------+--------------+-----------+-------+------------+
14 rows in set (0.00 sec)

mysql> update employees
    -> set salary = 50000
    -> where emp_name = 'Ravi Kumar';
Query OK, 1 row affected (0.06 sec)
Rows matched: 1  Changed: 1  Warnings: 0

mysql> update employees
    ->
    -> set salary = salary * 1.10
    -> where dept = 'IT';
ERROR 1054 (42S22): Unknown column 'dept' in 'where clause'
mysql> update employees
    -> set salary = salary * 1.10
    -> where deparment = 'IT';
ERROR 1054 (42S22): Unknown column 'deparment' in 'where clause'
mysql> update employees
    -> set salary = salary * 1.10
    -> where department = 'IT';
Query OK, 8 rows affected (0.06 sec)
Rows matched: 8  Changed: 8  Warnings: 0

mysql> select * from employees;
+--------+--------------+------------+------------------+----------+--------------+-----------+-------+------------+
| emp_id | emp_name     | department | job_role         | salary   | joining_date | location  | email | experience |
+--------+--------------+------------+------------------+----------+--------------+-----------+-------+------------+
|    101 | Ravi Kumar   | IT         | Developer        | 55000.00 | 2023-01-15   | Vizag     | NULL  |       NULL |
|    102 | Priya Sharma | HR         | HR Manager       | 55000.00 | 2022-06-20   | Hyderabad | NULL  |       NULL |
|    103 | Kiran Reddy  | IT         | Tester           | 44000.00 | 2023-03-10   | Vizag     | NULL  |       NULL |
|    104 | Sneha Rao    | Finance    | Accountant       | 48000.00 | 2021-11-25   | Chennai   | NULL  |       NULL |
|    105 | Arun Kumar   | IT         | Developer        | 66000.00 | 2020-08-18   | Bangalore | NULL  |       NULL |
|    106 | Divya Reddy  | HR         | Recruiter        | 35000.00 | 2024-01-05   | Vizag     | NULL  |       NULL |
|    107 | Suresh Babu  | Sales      | Executive        | 42000.00 | 2022-09-12   | Hyderabad | NULL  |       NULL |
|    108 | Anjali Devi  | IT         | Developer        | 77000.00 | 2019-05-30   | Chennai   | NULL  |       NULL |
|    109 | Mahesh Kumar | Sales      | Manager          | 65000.00 | 2020-02-14   | Bangalore | NULL  |       NULL |
|    110 | Lakshmi Rao  | Finance    | Analyst          | 52000.00 | 2023-07-22   | Hyderabad | NULL  |       NULL |
|    111 | Rahul Singh  | IT         | Developer        | 55000.00 | 2024-05-15   | Vizag     | NULL  |       NULL |
|    112 | Shruthi      | IT         | Tester           | 77000.00 | 2024-07-23   | Chennai   | NULL  |       NULL |
|    113 | Gautham Sai  | IT         | AI & ML Engineer | 99000.00 | 2024-02-27   | Banglore  | NULL  |       NULL |
|    114 | Nirup        | IT         | CyberSecurity    | 82500.00 | 2025-10-30   | Hyderabad | NULL  |       NULL |
+--------+--------------+------------+------------------+----------+--------------+-----------+-------+------------+
14 rows in set (0.00 sec)

mysql> update employees
    -> set salary = salary + 5000
    -> where department = 'HR';
Query OK, 2 rows affected (0.05 sec)
Rows matched: 2  Changed: 2  Warnings: 0

mysql> select * from employees;
+--------+--------------+------------+------------------+----------+--------------+-----------+-------+------------+
| emp_id | emp_name     | department | job_role         | salary   | joining_date | location  | email | experience |
+--------+--------------+------------+------------------+----------+--------------+-----------+-------+------------+
|    101 | Ravi Kumar   | IT         | Developer        | 55000.00 | 2023-01-15   | Vizag     | NULL  |       NULL |
|    102 | Priya Sharma | HR         | HR Manager       | 60000.00 | 2022-06-20   | Hyderabad | NULL  |       NULL |
|    103 | Kiran Reddy  | IT         | Tester           | 44000.00 | 2023-03-10   | Vizag     | NULL  |       NULL |
|    104 | Sneha Rao    | Finance    | Accountant       | 48000.00 | 2021-11-25   | Chennai   | NULL  |       NULL |
|    105 | Arun Kumar   | IT         | Developer        | 66000.00 | 2020-08-18   | Bangalore | NULL  |       NULL |
|    106 | Divya Reddy  | HR         | Recruiter        | 40000.00 | 2024-01-05   | Vizag     | NULL  |       NULL |
|    107 | Suresh Babu  | Sales      | Executive        | 42000.00 | 2022-09-12   | Hyderabad | NULL  |       NULL |
|    108 | Anjali Devi  | IT         | Developer        | 77000.00 | 2019-05-30   | Chennai   | NULL  |       NULL |
|    109 | Mahesh Kumar | Sales      | Manager          | 65000.00 | 2020-02-14   | Bangalore | NULL  |       NULL |
|    110 | Lakshmi Rao  | Finance    | Analyst          | 52000.00 | 2023-07-22   | Hyderabad | NULL  |       NULL |
|    111 | Rahul Singh  | IT         | Developer        | 55000.00 | 2024-05-15   | Vizag     | NULL  |       NULL |
|    112 | Shruthi      | IT         | Tester           | 77000.00 | 2024-07-23   | Chennai   | NULL  |       NULL |
|    113 | Gautham Sai  | IT         | AI & ML Engineer | 99000.00 | 2024-02-27   | Banglore  | NULL  |       NULL |
|    114 | Nirup        | IT         | CyberSecurity    | 82500.00 | 2025-10-30   | Hyderabad | NULL  |       NULL |
+--------+--------------+------------+------------------+----------+--------------+-----------+-------+------------+
14 rows in set (0.00 sec)

mysql> update employees
    -> set job_role = 'Senior Tester'
    -> where emp_id = 103;
Query OK, 1 row affected (0.04 sec)
Rows matched: 1  Changed: 1  Warnings: 0

mysql> select * from employees;
+--------+--------------+------------+------------------+----------+--------------+-----------+-------+------------+
| emp_id | emp_name     | department | job_role         | salary   | joining_date | location  | email | experience |
+--------+--------------+------------+------------------+----------+--------------+-----------+-------+------------+
|    101 | Ravi Kumar   | IT         | Developer        | 55000.00 | 2023-01-15   | Vizag     | NULL  |       NULL |
|    102 | Priya Sharma | HR         | HR Manager       | 60000.00 | 2022-06-20   | Hyderabad | NULL  |       NULL |
|    103 | Kiran Reddy  | IT         | Senior Tester    | 44000.00 | 2023-03-10   | Vizag     | NULL  |       NULL |
|    104 | Sneha Rao    | Finance    | Accountant       | 48000.00 | 2021-11-25   | Chennai   | NULL  |       NULL |
|    105 | Arun Kumar   | IT         | Developer        | 66000.00 | 2020-08-18   | Bangalore | NULL  |       NULL |
|    106 | Divya Reddy  | HR         | Recruiter        | 40000.00 | 2024-01-05   | Vizag     | NULL  |       NULL |
|    107 | Suresh Babu  | Sales      | Executive        | 42000.00 | 2022-09-12   | Hyderabad | NULL  |       NULL |
|    108 | Anjali Devi  | IT         | Developer        | 77000.00 | 2019-05-30   | Chennai   | NULL  |       NULL |
|    109 | Mahesh Kumar | Sales      | Manager          | 65000.00 | 2020-02-14   | Bangalore | NULL  |       NULL |
|    110 | Lakshmi Rao  | Finance    | Analyst          | 52000.00 | 2023-07-22   | Hyderabad | NULL  |       NULL |
|    111 | Rahul Singh  | IT         | Developer        | 55000.00 | 2024-05-15   | Vizag     | NULL  |       NULL |
|    112 | Shruthi      | IT         | Tester           | 77000.00 | 2024-07-23   | Chennai   | NULL  |       NULL |
|    113 | Gautham Sai  | IT         | AI & ML Engineer | 99000.00 | 2024-02-27   | Banglore  | NULL  |       NULL |
|    114 | Nirup        | IT         | CyberSecurity    | 82500.00 | 2025-10-30   | Hyderabad | NULL  |       NULL |
+--------+--------------+------------+------------------+----------+--------------+-----------+-------+------------+
14 rows in set (0.00 sec)

mysql> update employees
    -> set city = 'Hyderabad'
    -> where city = 'Vizag';
ERROR 1054 (42S22): Unknown column 'city' in 'where clause'
mysql> update employees
    -> set location = 'Hyderabad'
    -> where location = 'Vizag';
Query OK, 4 rows affected (0.00 sec)
Rows matched: 4  Changed: 4  Warnings: 0

mysql> select * from employees;
+--------+--------------+------------+------------------+----------+--------------+-----------+-------+------------+
| emp_id | emp_name     | department | job_role         | salary   | joining_date | location  | email | experience |
+--------+--------------+------------+------------------+----------+--------------+-----------+-------+------------+
|    101 | Ravi Kumar   | IT         | Developer        | 55000.00 | 2023-01-15   | Hyderabad | NULL  |       NULL |
|    102 | Priya Sharma | HR         | HR Manager       | 60000.00 | 2022-06-20   | Hyderabad | NULL  |       NULL |
|    103 | Kiran Reddy  | IT         | Senior Tester    | 44000.00 | 2023-03-10   | Hyderabad | NULL  |       NULL |
|    104 | Sneha Rao    | Finance    | Accountant       | 48000.00 | 2021-11-25   | Chennai   | NULL  |       NULL |
|    105 | Arun Kumar   | IT         | Developer        | 66000.00 | 2020-08-18   | Bangalore | NULL  |       NULL |
|    106 | Divya Reddy  | HR         | Recruiter        | 40000.00 | 2024-01-05   | Hyderabad | NULL  |       NULL |
|    107 | Suresh Babu  | Sales      | Executive        | 42000.00 | 2022-09-12   | Hyderabad | NULL  |       NULL |
|    108 | Anjali Devi  | IT         | Developer        | 77000.00 | 2019-05-30   | Chennai   | NULL  |       NULL |
|    109 | Mahesh Kumar | Sales      | Manager          | 65000.00 | 2020-02-14   | Bangalore | NULL  |       NULL |
|    110 | Lakshmi Rao  | Finance    | Analyst          | 52000.00 | 2023-07-22   | Hyderabad | NULL  |       NULL |
|    111 | Rahul Singh  | IT         | Developer        | 55000.00 | 2024-05-15   | Hyderabad | NULL  |       NULL |
|    112 | Shruthi      | IT         | Tester           | 77000.00 | 2024-07-23   | Chennai   | NULL  |       NULL |
|    113 | Gautham Sai  | IT         | AI & ML Engineer | 99000.00 | 2024-02-27   | Banglore  | NULL  |       NULL |
|    114 | Nirup        | IT         | CyberSecurity    | 82500.00 | 2025-10-30   | Hyderabad | NULL  |       NULL |
+--------+--------------+------------+------------------+----------+--------------+-----------+-------+------------+
14 rows in set (0.00 sec)

mysql> delete from employees where emp-id = 110;
ERROR 1054 (42S22): Unknown column 'emp' in 'where clause'
mysql> delete from employees where emp_id = 110;
Query OK, 1 row affected (0.04 sec)

mysql> delete from employees where sal < 40000;
ERROR 1054 (42S22): Unknown column 'sal' in 'where clause'
mysql> delete from employees where salary < 40000;
Query OK, 0 rows affected (0.00 sec)

mysql> delete from employees where department = 'Finance';
Query OK, 1 row affected (0.04 sec)

mysql> select * from employees;
+--------+--------------+------------+------------------+----------+--------------+-----------+-------+------------+
| emp_id | emp_name     | department | job_role         | salary   | joining_date | location  | email | experience |
+--------+--------------+------------+------------------+----------+--------------+-----------+-------+------------+
|    101 | Ravi Kumar   | IT         | Developer        | 55000.00 | 2023-01-15   | Hyderabad | NULL  |       NULL |
|    102 | Priya Sharma | HR         | HR Manager       | 60000.00 | 2022-06-20   | Hyderabad | NULL  |       NULL |
|    103 | Kiran Reddy  | IT         | Senior Tester    | 44000.00 | 2023-03-10   | Hyderabad | NULL  |       NULL |
|    105 | Arun Kumar   | IT         | Developer        | 66000.00 | 2020-08-18   | Bangalore | NULL  |       NULL |
|    106 | Divya Reddy  | HR         | Recruiter        | 40000.00 | 2024-01-05   | Hyderabad | NULL  |       NULL |
|    107 | Suresh Babu  | Sales      | Executive        | 42000.00 | 2022-09-12   | Hyderabad | NULL  |       NULL |
|    108 | Anjali Devi  | IT         | Developer        | 77000.00 | 2019-05-30   | Chennai   | NULL  |       NULL |
|    109 | Mahesh Kumar | Sales      | Manager          | 65000.00 | 2020-02-14   | Bangalore | NULL  |       NULL |
|    111 | Rahul Singh  | IT         | Developer        | 55000.00 | 2024-05-15   | Hyderabad | NULL  |       NULL |
|    112 | Shruthi      | IT         | Tester           | 77000.00 | 2024-07-23   | Chennai   | NULL  |       NULL |
|    113 | Gautham Sai  | IT         | AI & ML Engineer | 99000.00 | 2024-02-27   | Banglore  | NULL  |       NULL |
|    114 | Nirup        | IT         | CyberSecurity    | 82500.00 | 2025-10-30   | Hyderabad | NULL  |       NULL |
+--------+--------------+------------+------------------+----------+--------------+-----------+-------+------------+
12 rows in set (0.00 sec)
